{
  "contractVersion": "0.2.0",
  "runtimeVersion": "0.2.0-dev",
  "backend": {
    "name": "macos-placeholder",
    "version": "0.0.0"
  },
  "platform": {
    "os": "macos",
    "version": "unknown",
    "architecture": "arm64"
  },
  "capabilities": [
    {
      "name": "runtime.info",
      "available": true,
      "validationState": "PROPOSED",
      "strategies": ["local-json-rpc"]
    }
  ]
}
